id	title	publication_title	description	technology	accession_code	alternate_accession_code	submitter_institution	has_publication	publication_doi	publication_authors	sample_metadata_fields	platform_names	platform_accession_codes	organism_names	downloadable_organism_names	pubmed_id	num_total_samples	num_processed_samples	num_downloadable_samples	source_first_published
33246	Blood Transcriptional Profiles in Human Active and Latent Tuberculosis	An interferon-inducible neutrophil-driven blood transcriptional signature in human tuberculosis.	This series regroups different datasets (training set, test set, validation set, longitudinal set, separated cell set) to identify and characterise a specific transcriptional signature for patients with active TB, distinct from patients with latent TB and healthy controls. The training set dataset was used to identify a whole blood transcriptional signature for active TB patients in London, across a range of ethnicity. This signature was then validated in an independent cohort of patients, also recruited in London (the test set), and then further confirmed in an additional independent cohort recruited in Cape Town, South Africa (validation set), in order to confirm that the defined signature was present in both high (Cape Town, South Africa) and medium incidence regions (London, UK). The longitudinal dataset was then used to explore how successful TB treatment modifies this transcriptional signature. The separated cell set compares the transcriptional profiles in purified cell subsets (neutrophils, monocytes and T cells) to assess which cell types are contributing to the whole blood signature, and in what way. These studies may ultimately help to improve the diagnosis of active tuberculosis which normally relies on culture of the bacilli, which can take up to 6 weeks, and sometimes the bacilli cannot be obtained from sputum thus requiring invasive techniques such as bronchoalveolar lavage (BAL). In some cases (30%) the bacill cannot be grown from sputum or BAL. Any diagnostic tool would need to be valid across a range of ethnicities, and be valid in both high and low incidence countries. A further aim was to determine whether latent TB patients have a distinct homogeneous or heterogeneous signature, since it is not currently possible to determine using present tests (Tuberculin skin test - TST - or MTb antigen responsiveness of blood cells to produce IFN-gamma - IGRA assay) whether the mycobacteria have been cleared, are still present but are controlled by an active immune response, or to predict which patients will develop active TB. Defining heterogeneity in the latent TB patients would be an important step in developing diagnostics which could detect those most at risk of developing active TB, and thus enable targeted preventive therapy. The latter situation may be determined if Latent patients have a blood transcriptional signature similar to that in Active patients. The transcriptional signature in whole blood and cell subsets from Active TB patients may also provide information as to the factors leading to immunopathogenesis, thus possibly identifying therapeutic targets. The transcriptional profile in latent TB may give information regarding protective factors controlling the infection, important for vaccine development. Finally, definition of a transcriptional signature which responds to therapy could facilitate the development of surrogate biomarkers for drug or vaccine studies.	MICROARRAY	GSE19491	E-GEOD-19491	Baylor Institute for Immunology Research	FALSE								20725040	498	498	498	2009-12-15
23834	Genome wide transcriptional profiling of HIV positive and negative children with active tuberculosis, latent TB infection and other diseases	Diagnosis of childhood tuberculosis and host RNA expression in Africa.	This SuperSeries is composed of the SubSeries listed below.	MICROARRAY	GSE39941	E-GEOD-39941	Imperial College London	FALSE								24785206	491	491	491	2012-08-07
23905	Human whole blood microarray study to compare patients with tuberculosis, sarcoidosis, pneumonia, and lung cancer	Transcriptional blood signatures distinguish pulmonary tuberculosis, pulmonary sarcoidosis, pneumonias and lung cancers.	This SuperSeries is composed of the SubSeries listed below.	MICROARRAY	GSE42834	E-GEOD-42834	MRC National Institute for Medical Research	FALSE								23940611	356	16	16	2012-12-10
23762	Genome wide transcriptional profiling of HIV positive and negative children with active tuberculosis, latent TB infection and other diseases from South Africa and Malawi	Diagnosis of childhood tuberculosis and host RNA expression in Africa.	The study aimed to define transcriptional signatures for detection of active TB (TB) compared to latent TB infection (LTBI) as well as to other diseases (OD) with similar clinical phenotypes in patients with and without HIV in two African paediatric populations.	MICROARRAY	GSE39940	E-GEOD-39940	Imperial College London	FALSE								24785206	334	334	334	2012-08-07
23612	Deciphering the genetic architecture of variation in the immune response to Mycobacterium tuberculosis infection (expression)	Deciphering the genetic architecture of variation in the immune response to Mycobacterium tuberculosis infection.	Identification of genetic polymorphisms associated with inter-individual variation in immune response to Mycobacterium tuberculosis infection.	MICROARRAY	GSE34151	E-GEOD-34151	luis	FALSE								22233810	259	259	259	2011-12-05
23764	Detectable changes in the blood transcriptome are present after two weeks of antituberculosis therapy	Detectable changes in the blood transcriptome are present after two weeks of antituberculosis therapy.	Analysis of UK blood transcriptional profiles before treatment to indentify changes that occur during (2 weeks, 2 months), at the end of treatment (6 months) and after treatment (12 months)	MICROARRAY	GSE40553	E-GEOD-40553	MRC National Institute for Medical Research	FALSE								23056259	204	204	204	2012-09-03
25325	The transcriptional signature of active tuberculosis reflects symptom status in extra-pulmonary and pulmonary tuberculosis	The Transcriptional Signature of Active Tuberculosis Reflects Symptom Status in Extra-Pulmonary and Pulmonary Tuberculosis.	Background:   Mycobacterium tuberculosis infection is a leading cause of infectious death worldwide. Gene-expression microarray studies profiling the blood transcriptional response of tuberculosis (TB) patients have been undertaken in order to better understand the host immune response as well as to identify potential biomarkers of disease. To date most of these studies have focused on pulmonary TB patients with gene-expression profiles of extra-pulmonary TB patients yet to be compared to those of patients with pulmonary TB or sarcoidosis.	MICROARRAY	GSE83456	E-GEOD-83456	National Institute for Medical Research (NIMR)	FALSE								27706152	202	202	202	2016-06-16
4568	Adjuvant associated peripheral-blood mRNA profiles and kinetics induced by the adjuvanted recombinant-protein candidate tuberculosis vaccine M72/AS01 in BCG-vaccinated adults	Adjuvant-Associated Peripheral Blood mRNA Profiles and Kinetics Induced by the Adjuvanted Recombinant Protein Candidate Tuberculosis Vaccine M72/AS01 in Bacillus Calmette-Guérin-Vaccinated Adults.	Systems biology has the potential to identify gene signatures associated with vaccine immunogenicity or protective efficacy. The main objective of our study was to identify optimal post-vaccination time points for evaluating blood RNA-expression profiles in recipients of the candidate tuberculosis vaccine M72/AS01. In this phase II open-label study (NCT01669096), healthy Bacillus Calmette-Gurin (BCG)-primed, HIV-negative adults were administered two doses (30-days apart) of M72/AS01. Blood samples were collected pre-dose 1, pre-dose 2 and 1, 7, 10, 14, 17 and 30 days post-dose 2. RNA expression in blood and peripheral-blood mononuclear cells (PBMCs) was quantified using microarray technology. The data analysis used as a reference, a PBMC-gene signature that was associated with the protective efficacy of a similarly adjuvanted candidate malaria vaccine. Peripheral-blood CD4+ T-cell reactivity, serum interferon-gamma (IFNG) concentrations and safety were also assessed. Twenty subjects completed the study and 18 subjects received two doses. The observed safety profile was similar to previous trials. Serum IFNG responses and M72-specific CD4+ T cell responses to vaccination were detected as expected, based on previous trial experience. PBMC and whole-blood RNA-expression data at day 14 post-dose 2 relative to pre-vaccination and whole-blood RNA-expression data at 7, 10, and 17 days  post-dose 2 relative to pre-vaccination could be used to classify vaccine recipients into gene-signature positive or gene-signature negative groups. In conclusion, whole blood sampled from the 7, 10, 14, or 17  day post-vaccination time points, in addition to pre-vaccination, could be selected to assess potentially clinically relevant responses to M72/AS01 using transcriptome analysis.	MICROARRAY	GSE102459	E-GEOD-102459	GSK Vaccines	FALSE								29632533	164	161	161	2017-08-09
23719	Genome wide transcriptional profiling of HIV positive and negative children with active tuberculosis, latent TB infection and other diseases from Kenya	Diagnosis of childhood tuberculosis and host RNA expression in Africa.	The study aimed to define transcriptional signatures for detection of active TB (TB) compared to latent TB infection (LTBI) as well as to other diseases (OD) with similar clinical phenotypes in patients with and without HIV in a paediatric cohort from Kenya	MICROARRAY	GSE39939	E-GEOD-39939	Imperial College London	FALSE								24785206	157	157	157	2012-08-07
2014	Tuberculosis Patients Blood Gene Expression Through Treatment	Distinct phases of blood gene expression pattern through tuberculosis treatment reflect modulation of the humoral immune response.	Background  Accurate assessment of treatment efficacy would facilitate clinical trials of new anti-tuberculosis drugs. TB patients exhibit altered peripheral immunity which reverts during successful treatment. We hypothesised that these changes could be observed in whole blood transcriptome profiles.  Methods  Ex vivo blood samples from 27 pulmonary TB patients were assayed at diagnosis and during conventional treatment. RNA was processed and hybridised to Affymetrix GeneChips, to determine expression of over 47,000 transcripts.  Findings  There were significant changes in expression of over 4,000 genes during treatment. Rapid, large scale changes were detected, with down-regulated expression of ~1,000 genes within the first week, including inflammatory markers such as the complement components C1q and C2. This was followed by slower changes in expression of different networks of genes, including a later increase in expression of B cell markers, transcription factors and signalling molecules.  Interpretation  The expression of many genes is drastically altered during TB disease, with components of the humoral immune response being markedly affected. The treatment-induced restoration reflects the simultaneous suppression and activation of different immune responses in TB. The rapid initial down-regulation of expression of inflammatory mediators coincides with rapid killing of actively dividing bacilli, whereas slower delayed changes occur as drugs act on dormant bacilli and as lung pathology resolves. Measurement of biosignatures during clinical trials of new drugs could be useful predictors of rapid bactericidal or sterilizing drug activity.	MICROARRAY	GSE31348	E-GEOD-31348	London School of Hygiene & Tropical Medicine	FALSE								22872737	135	129	129	2011-08-12
24428	Blood Transcriptional Signature of hyperinflammation in HIV-associated Tuberculosis	HIV-tuberculosis-associated immune reconstitution inflammatory syndrome is characterized by Toll-like receptor and inflammasome signalling.	Patients with HIV-associated TB are known to experience systemic hyperinflammation, clinically known as immune reconstitution inflammatory syndrome (IRIS), following the commencement of antiretroviral therapy (ART). No prognostic markers or biomarkers have been identified to date and little is known about the mechanism mediating the hyperinflammation. We recruited a prospective cohort of 63 patients with HIV-associated TB, 33 of whom developed TB-IRIS. Of which transcriptomic profiling was performed using longitudinal whole blood RNA samples from 15 non-IRIS and 17 TB-IRIS patients. Transcriptomic signatures that distinguish patients who would eventually develop IRIS were identified as early as week 0.5 (2-5 days post-ART) and predicted a downstream activation of proinflammatory cytokines. At the peak of IRIS (week 2), transcriptomic signatures were overrepresented by innate receptor signaling pathways including toll-like receptor, IL-1 receptor and TREM-1.	MICROARRAY	GSE58411	E-GEOD-58411	National Institute for Medical Research	FALSE								26399326	107	107	107	2014-06-11
23863	Human whole blood microarray study to compare patients with tuberculosis, sarcoidosis, pneumonia, and lung cancer (training)	Transcriptional blood signatures distinguish pulmonary tuberculosis, pulmonary sarcoidosis, pneumonias and lung cancers.	This study used whole blood transcriptional signatures from patients with tuberculosis compared to those with similar pulmonary diseases, sarcoidosis, pneumonia and primary lung cancer. TB and sarcoidosis had similar signatures that were distinct from pneumonia and lung cancer.	MICROARRAY	GSE42830	E-GEOD-42830	MRC National Institute for Medical Research	FALSE								23940611	95	16	16	2012-12-10
21967	Transcription profiling by array of human dendritic cells and macrophages infected with Mycobacterium tuberculosis	Probing host pathogen cross-talk by transcriptional profiling of both Mycobacterium tuberculosis and infected human dendritic cells and macrophages	Human monocytes were purified from cytapheresis rings and differentiated into macrophages or DCs according to a previously described procedure
	MICROARRAY	E-MEXP-3521	NA	University of Milano-Bicocca	TRUE									72	72	72	2011-09-28
4071	Excessive Cytolytic Responses Predict Tuberculosis Relapse After Apparently Successful Treatment	Excessive Cytolytic Responses Predict Tuberculosis Relapse After Apparently Successful Treatment.	Background	MICROARRAY	GSE67589	E-GEOD-67589	London School of Hygiene & Tropical Medicine	FALSE								26351358	57	56	56	2015-04-06
33231	Blood Transcriptional Profiles in Active and Latent Tuberculosis UK (Training Set)	An interferon-inducible neutrophil-driven blood transcriptional signature in human tuberculosis.	The aim of the project was to define transcriptional signatures in whole blood of TB patients (before drug treatment) and healthy controls to distinguish the signature of Latent and Active TB patients from each other and from healthy controls. This will help in diagnosis of active tuberculosis which normally relies on culture of the bacilli, which can take up to 6 wks, and sometimes the bacilli cannot be obtained from sputum thus requiring invasive techniques obtaining bronchoalveolar lavage (BAL). In some cases the bacill cannot be grown from sputum or BAL.   Secondly the aim was to determine whether Latent patients have a homogeneous or heterogeneous signature, one may expect the latter since it is not possible to determine by the present tests (Tuberculin skin test - TST - or MTb antigen responsiveness of blood cells to produce IFN-gamma - IGRA assay) whether the mycobacteria has been cleared, is still present but is controlled, or if patients are recently infected or reactivated and will develop active TB. The latter situation may be determined if Latent patients have a blood transcriptional signature similar to that in Active patients. The transcriptional signature in Active TB patients may also provide information as to the factors leading to immunopathogenesis, thus possibly identifying therapeutic targets. The transcriptional profile in Latent TB may give information as to the protective factors controlling the infection, thus important for monitoring vaccine development.   A further aim was to examine the transcriptional blood profile of active TB patients at the time of recruitment (before drug treatment) and then subsequently at specific time points after drug treatment to determine whether the signature is extingsuihed with treatment and when. London is a site of intermediate burden of TB - the study was initiated in London, across a broad range of ethnicities to obtain a robust signature that could be used in different developing countries where there is a high burden TB disease.	MICROARRAY	GSE19439	E-GEOD-19439	Baylor Institute for Immunology Research	FALSE								20725040	42	42	42	2009-12-11
10164	The time-course transcriptomic responses of THP-1 human macrophage-like cells  to W-Beijing Mycobacterium tuberculosis strains of different sublineages	An interferon-related signature in the transcriptional core response of human macrophages to Mycobacterium tuberculosis infection.	The W-Beijing family of Mycobacterium tuberculosis (Mtb) strains is known for its high-prevalence and -virulence, as well as for its genetic diversity, as recently reported by our laboratories and others. However, little is known about how the immune system responds to these strains. To explore this issue, here we used reverse engineering and genome-wide expression profiling of human macrophage-like THP-1 cells infected by different Mtb strains of the W-Beijing family, as well as by the reference laboratory strain H37Rv. Detailed data mining revealed that host cell transcriptome responses to H37Rv and to different strains of the W-Beijing family are similar and overwhelmingly induced during Mtb infections, collectively typifying a robust gene expression signature (""THP1r2Mtb-induced signature""). Analysis of the putative transcription factor binding sites in promoter regions of genes in this signature identified several key regulators, namely STATs, IRF-1, IRF-7, and Oct-1, commonly involved in interferon-related immune responses. The THP1r2Mtb-induced signature appeared to be highly relevant to the interferon-inducible signature recently reported in active pulmonary tuberculosis patients, as revealed by cross-signature and cross-module comparisons. Further analysis of the publicly available transcriptome data from human patients showed that the signature appears to be relevant to active pulmonary tuberculosis patients and their clinical therapy, and be tuberculosis specific. Thus, our results provide an additional layer of information at the transcriptome level on mechanisms involved in host macrophage response to Mtb, which may also implicate the robustness of the cellular defense system that can effectively fight against genetic heterogeneity in this pathogen.	MICROARRAY	GSE29628	E-GEOD-29628	University of Bristol	FALSE								22675550	40	40	40	2011-05-31
33229	Transcriptional profiles in Blood of patients with Tuberculosis - Longitudinal Study	An interferon-inducible neutrophil-driven blood transcriptional signature in human tuberculosis.	The aim of the longitudinal analysis was to examine the transcriptional blood profile of active TB patients at the time of recruitment (before drug treatment) and then subsequently at specific time points after drug treatment to determine whether the signature is extinguished with treatment and when.	MICROARRAY	GSE19435	E-GEOD-19435	Baylor Institute for Immunology Research	FALSE								20725040	33	33	33	2009-12-11
24616	Expression profiling of lymph nodes in tuberculosis patients reveal inflammatory milieu at site of infection		Extrapulmonary manifestations constitute 15-20% of tuberculosis cases, with lymph node as the most common site. Understanding of disease etiology is limited due to the lack of understanding patients infected tissue milieu. This study was designed to perform global transcriptome analysis of lymph node tissues from healthy individuals and Mycobacterium tuberculosis infected lymph nodes of patients to decipher the local response of infected tissue.	MICROARRAY	GSE63548	E-GEOD-63548	CSIR-Institute of Genomics and Integrative Biology	FALSE									26	26	26	2014-11-21
8894	Identification of Tuberculosis Susceptibility Genes with Human Macrophage Gene Expression Profiles	Identification of tuberculosis susceptibility genes with human macrophage gene expression profiles.	Although host genetics influences susceptibility to tuberculosis, few genes determining disease outcome have been identified. We hypothesized that macrophages from individuals with different clinical manifestations of tuberculosis infection would have distinct gene expression profiles, and that polymorphisms in these genes may also be associated with susceptibility to TB.	MICROARRAY	GSE11199	E-GEOD-11199	1.	Oxford University Clinical Research Unit	FALSE								19057661	24	22	22	2008-04-17
67264	Infection of monocytes from tuberculosis patients with two virulent clinical isolates of Mycobacterium tuberculosis induces alterations in myeloid effector functions.	Infection of Monocytes From Tuberculosis Patients With Two Virulent Clinical Isolates of <i>Mycobacterium tuberculosis</i> Induces Alterations in Myeloid Effector Functions.	Monocytes play a critical role during infection with Mycobacterium tuberculosis (Mtb). They are recruited to the lung where they participate in the contention of infection. Alternatively, inflammatory monocytes may help in prolonging inflammation or serve as niches for Mtb infection. Also, monocyte response to infection may vary depending on the particularities of the clinical isolate of Mtb from which they are infected. In this pilot study, using microarrays we have examined the global mRNA profiles of circulating human monocytes from healthy individuals and patients with active tuberculosis (TB).	MICROARRAY	GSE139871	E-GEOD-139871	Universidad de antioquia	FALSE								32391286	24	24	24	2019-11-04
16301	Mycobacterium tuberculosis Chaperonin 60.1 has Bipolar Effects on Human peripheral blood-derived Monocytes		Chaperonin 60 (Cpn60) is a prototypic molecular chaperone essential for cellular function due to its protein folding actions.  However, over the past decade it has been established that Cpn60 can be released by human cells and by certain bacteria to act as an extracellular signalling protein. Mycobacterium tuberculosis produces two Cpn60 proteins: Cpn60.1 and Cpn60.2. We recently generated a M. tuberculosis mutant with an inactivated cpn60.1 gene and demonstrated that granuloma formation was impaired after murine/guinea pig infection.  This finding suggested that Cpn60.1 may interact with the cellular organisation of the host response to M. tuberculosis bacilli.  In this study, we report that recombinant M. tuberculosis Cpn60.1 has both pro- and anti-inflammatory effects on human circulating monocytes. At high concentrations, recombinant Cpn60.1 induces the synthesis of TNF-, IL6, and IL8, and promotes the phosphorylation of NF-Bp65, p44/42MAPK and p38 MAPK. At lower concentrations M. tuberculosis Cpn60.1 inhibits lipopolysaccharide-induced release of TNF-, and monocyte transcriptional activation program. Both effects are abrogated by proteolysis of Cpn60.1 and therefore cannot be attributed to contamination with lipopolysaccharide. Competition with LPS for binding to a common receptor, the release of IL-10 or down-regulation of TLR4 on the cell surface were excluded as explanations for the inhibitory activity of Cpn60.1. We therefore conclude that M. tuberculosis Cpn60.1 is an unusual protein with the ability to induce bipolar effects on human monocytes, which may help explain the pathology of granuloma formation in tuberculosis.	MICROARRAY	GSE18794	E-GEOD-18794	Imperial College London	FALSE									21	21	21	2009-10-29
