id	title	publication_title	description	technology	accession_code	alternate_accession_code	submitter_institution	has_publication	publication_doi	publication_authors	sample_metadata_fields	platform_names	platform_accession_codes	organism_names	downloadable_organism_names	pubmed_id	num_total_samples	num_processed_samples	num_downloadable_samples	source_first_published
10341	Tuberculosis Patients Blood Gene Expression Through Treatment (cured and end-of-treatment patients)	Distinct phases of blood gene expression pattern through tuberculosis treatment reflect modulation of the humoral immune response.	Background  Accurate assessment of treatment efficacy would facilitate clinical trials of new anti-tuberculosis drugs. TB patients exhibit altered peripheral immunity which reverts during successful treatment. We hypothesised that these changes could be observed in whole blood transcriptome profiles.  Methods  Ex vivo blood samples from 27 pulmonary TB patients were assayed at diagnosis and during conventional treatment. RNA was processed and hybridised to Affymetrix GeneChips, to determine expression of over 47,000 transcripts.  Findings  There were significant changes in expression of over 4,000 genes during treatment. Rapid, large scale changes were detected, with down-regulated expression of ~1,000 genes within the first week, including inflammatory markers such as the complement components C1q and C2. This was followed by slower changes in expression of different networks of genes, including a later increase in expression of B cell markers, transcription factors and signalling molecules.  Interpretation  The expression of many genes is drastically altered during TB disease, with components of the humoral immune response being markedly affected. The treatment-induced restoration reflects the simultaneous suppression and activation of different immune responses in TB. The rapid initial down-regulation of expression of inflammatory mediators coincides with rapid killing of actively dividing bacilli, whereas slower delayed changes occur as drugs act on dormant bacilli and as lung pathology resolves. Measurement of biosignatures during clinical trials of new drugs could be useful predictors of rapid bactericidal or sterilizing drug activity.	MICROARRAY	GSE36238	E-GEOD-36238	London School of Hygiene & Tropical Medicine	FALSE								22872737	18	17	17	2012-03-02
2515	Innate and antigen-specific cytotoxic cells and Paradoxical HIV-associated Tuberculosis Immune reconstitution inflammatory syndrome (TB-IRIS)	Cytotoxic mediators in paradoxical HIV-tuberculosis immune reconstitution inflammatory syndrome.	Tuberculosis Immune Reconstitution Inflammatory Syndrome (TB-IRIS) frequently complicates combined anti-retroviral therapy (ART) and anti-tubercular therapy in HIV-1 co-infected tuberculosis (TB) patients. The immunopathological mechanism underlying TB-IRIS is incompletely defined.	MICROARRAY	GSE48237	E-GEOD-48237	University of Cape Town	FALSE								25589068	14	14	14	2013-06-24
14722	Transcriptomics of vitamin D treatment effects in Mycobacterium tuberculosis-infected THP-1 cells	Cutting edge: Vitamin D regulates lipid metabolism in Mycobacterium tuberculosis infection.	Previous reports have shown low vitamin D serum levels and polymorphisms in the vitamin D receptor (VDR) to be associated with increased risk for TB. Given that 1,25-dihydroxyvitamin D3 has a role in lipid metabolism control, we tested whether the link between 1,25-dihydroxyvitamin D3 and tuberculosis involves macrophage lipid metabolism. Since formation of lipid droplets (LD) is a hallmark of lipid dysregulation in M. tuberculosis-infected macrophages, we measured LD content as a readout of altered lipid metabolism in infected THP-1 cells.  Induction of LD, which peaked by 24 hours post-infection was prevented by addition of 1,25-dihydroxyvitamin D3 at the time of infection. To investigate the mechanism of  1,25-dihydroxyvitamin D3  modulation of LD formation, we analyzed the transcriptome of M. tuberculosis-infected THP-1 cells with and without 1,25-dihydroxyvitamin D3 treatment.	MICROARRAY	GSE57028	E-GEOD-57028	Knowledge Synthesis Inc.	FALSE								24899504	14	2	2	2014-04-23
15646	Expression data of lncRNAs and mRNAs extracted from PBMCs of tuberculosis patients and healthy individuals[HTA2.0]		Tuberculosis (TB) is the ninth leading cause of death worldwide and the leading cause from a single infectious agent, ranking above HIV/AIDS.Although considerable advances have been achieved in recent years, the genetic and molecular mechanisms underlying this disease remain largely unclear.	MICROARRAY	GSE119143	E-GEOD-119143	West China Hospital of Sichuan University	FALSE									12	12	12	2018-08-28
15137	Engagement of the Aryl Hydrocarbon Receptor in Mycobacterium tuberculosisInfected Macrophages Has Pleiotropic Effects on Innate Immune Signaling	Engagement of the Aryl Hydrocarbon Receptor in Mycobacterium tuberculosis-Infected Macrophages Has Pleiotropic Effects on Innate Immune Signaling.	Understanding the mechanisms of host macrophage responses to Mycobacterium tuberculosis (M.tb.) is essential for uncovering potential avenues of intervention to boost host resistance to infection. Macrophage transcriptome profiling revealed M.tb. infection strongly induced expression of several enzymes controlling tryptophan (Trp) catabolism. This included indole 2,3-dioxygenase 1 (IDO1) and tryptophan 2,3-dioxygenase (TDO2), which catalyze the rate-limiting step in the kynurenine pathway, producing ligands for the aryl hydrocarbon receptor (AHR). The AHR and heterodimeric partners AHR nuclear translocator (ARNT) and RELB are robustly expressed, and AHR and RELB levels further increased during infection. Infection enhanced AHR/ARNT and AHR/RELB DNA binding, and stimulated expression of AHR target genes, including that encoding the inflammatory cytokine IL1beta. AHR target gene expression was further enhanced by exogenous kynurenine, and exogenous Trp, kynurenine or synthetic agonist indirubin reduced mycobacterial viability. Comparative expression profiling revealed that AHR ablation diminished expression of numerous genes implicated in innate immune responses, including several cytokines. Notably, AHR depletion reduced expression of IL23A and IL12B transcripts, which encode subunits of interleukin 23 (IL23), a macrophage cytokine that stimulates production of IL22 by innate lymphoid cells. The AHR directly induced IL23A transcription in human and mouse macrophages through near-upstream enhancer regions. Taken together, these findings show that AHR signaling is strongly engaged in Mtb-infected macrophages, and has widespread effects on innate immune responses. Moreover, they reveal a cascade of AHR-driven innate immune signaling, as IL1B (IL-1) and IL23 stimulate T cell subsets producing IL22, another direct target of AHR transactivation.	MICROARRAY	GSE70200	E-GEOD-70200	McGill University	FALSE								26416282	8	5	5	2015-06-23
9407	PBMCs exposed to the Mycobacterium tuberculosis H37Ra strain	Microarray analysis of the in vitro granulomatous response to Mycobacterium tuberculosis H37Ra.	Human peripheral blood mononuclear cells were cultured in presence of H37Ra strain at 37oC, 5%CO2. Cellular aggregates were collected at 24h, and RNA extracted and hybridized to Affymetrix microarrays (HG-U133). Raw data from microarray experiments was analyzed with dCHIP and SAM programs to determine the significance of changes at the biological context.	MICROARRAY	GSE16250	E-GEOD-16250	Universidad de Cartagena	FALSE								26019382	6	6	6	2009-05-27
31577	Genome-wide gene expression analysis for target genes to differentiate patients with intestinal tuberculosis and Crohns disease	Genome-wide gene expression analysis for target genes to differentiate patients with intestinal tuberculosis and Crohn's disease and discriminative value of FOXP3 mRNA expression.	This study aimed at genome-wide gene expression analysis of colonic biopsies from confirmed cases of intestinal tuberculosis (ITB) and Crohn's disease (CD) in comparison to controls. Further, to evaluate the role of T regulatory cells, Foxp3 mRNA expression was quantified in serum as well as colonic biopsies of patients with intestinal tuberculosis, Crohn's disease and controls.	MICROARRAY	GSE26305	E-GEOD-26305	AIIMS	FALSE								25969456	6	6	6	2010-12-27
10393	Comparison of M. tuberculosis and M. bovis BCG in diluted whole blood cultures	Excessive Cytolytic Responses Predict Tuberculosis Relapse After Apparently Successful Treatment.	Despite wide scale vaccination with Mycobacterium bovis BCG, the prevalence of tuberculosis remains high, reflecting the global variable efficacy of this vaccine against adult pulmonary TB.  Characterisation of different immune responses to M. tuberculosis and M. bovis BCG would increase understanding of pathology following M. tuberculosis infection or reactivation, and would facilitate the rational design of a new vaccine. Gene expression profiling was conducted on samples from diluted whole blood cultures from three healthy donors following incubation with live mycobacteria for six days.  Approximately 8,000 gene entities were at least two-fold up- or down- regulated by the mycobacteria, and both mycobacteria induced similar expression changes in approximately 2,300 genes. Strikingly, many genes exhibited qualitatively different expression patterns, with over 1,000 genes up-regulated in response to M. bovis BCG but not changed by M. tuberculosis. Gene Ontology analysis revealed that the genes which failed to upregulate in M. tuberculosis-infected cultures included a large proportion of genes with lysosomal function. The inhibited up-regulation of expression of IFN--inducible protein 30, acid phosphatase 2, cathepsin B and GM2 ganglioside activator was verified in samples from six biologically independent donors by qRT-PCR. The failure to up-regulate these genes in response to M. tuberculosis may constitute an immune evasion mechanism, preventing intracellular killing and antigen presentation.	MICROARRAY	GSE45386	E-GEOD-45386	London School of Hygiene & Tropical Medicine	FALSE								26351358	3	3	3	2013-03-21
