ID	Description	GeneRatio	BgRatio	pvalue	p.adjust	qvalue	geneID	Count
GO:1902806	regulation of cell cycle G1/S phase transition	14/195	175/16259	2.5060305127319506e-8	8.42778061431755e-5	7.059092265337578e-5	CDK7/CDKN1A/CDKN1B/CDKN2A/EGFR/ID2/MNAT1/PSME1/PTPN6/RB1/CCL2/SOX2/TBX2/KIF14	14
GO:2000045	regulation of G1/S transition of mitotic cell cycle	12/195	155/16259	3.668028882357106e-7	3.956885476193783e-4	3.3142793978730025e-4	CDK7/CDKN1A/CDKN1B/CDKN2A/EGFR/ID2/MNAT1/PSME1/PTPN6/RB1/CCL2/KIF14	12
GO:0000079	regulation of cyclin-dependent protein serine/threonine kinase activity	9/195	79/16259	4.2591081553394445e-7	3.956885476193783e-4	3.3142793978730025e-4	CDK7/CDKN1A/CDKN1B/CDKN2A/CEBPA/EGFR/MNAT1/PSMD10/CDK5R1	9
GO:1904029	regulation of cyclin-dependent protein kinase activity	9/195	82/16259	5.879719243533005e-7	3.956885476193783e-4	3.3142793978730025e-4	CDK7/CDKN1A/CDKN1B/CDKN2A/CEBPA/EGFR/MNAT1/PSMD10/CDK5R1	9
GO:0006986	response to unfolded protein	11/195	133/16259	5.882969783220016e-7	3.956885476193783e-4	3.3142793978730025e-4	DAXX/ATF6/ERO1A/DNAJB2/HSPA4/HSPB1/HSPD1/BAX/WFS1/NCK2/MBTPS1	11
GO:0140747	regulation of ncRNA transcription	9/195	91/16259	1.4331885171683557e-6	7.704305854097709e-4	6.453111246401386e-4	PWP1/EGFR/EGR1/ETS1/FOS/GATA3/JUN/BMP4/NR1H2	9
GO:1902893	regulation of miRNA transcription	8/195	69/16259	1.6582942984835295e-6	7.704305854097709e-4	6.453111246401386e-4	EGFR/EGR1/ETS1/FOS/GATA3/JUN/BMP4/NR1H2	8
GO:0061614	miRNA transcription	8/195	70/16259	1.8532126386006696e-6	7.704305854097709e-4	6.453111246401386e-4	EGFR/EGR1/ETS1/FOS/GATA3/JUN/BMP4/NR1H2	8
GO:1904035	regulation of epithelial cell apoptotic process	9/195	95/16259	2.0618124498031334e-6	7.704305854097709e-4	6.453111246401386e-4	CDKN1B/PAK4/GATA3/GPER1/SERPINE1/BAX/RB1/CCL2/WFS1	9
GO:1902895	positive regulation of miRNA transcription	7/195	51/16259	2.374279491389568e-6	7.907114348103989e-4	6.622983237249409e-4	EGFR/EGR1/ETS1/FOS/GATA3/JUN/NR1H2	7
GO:0035966	response to topologically incorrect protein	11/195	155/16259	2.6811324225657262e-6	7.907114348103989e-4	6.622983237249409e-4	DAXX/ATF6/ERO1A/DNAJB2/HSPA4/HSPB1/HSPD1/BAX/WFS1/NCK2/MBTPS1	11
GO:1904019	epithelial cell apoptotic process	10/195	126/16259	2.8214502580210485e-6	7.907114348103989e-4	6.622983237249409e-4	CDKN1B/PAK4/DNMT3A/GATA3/GPER1/SERPINE1/BAX/RB1/CCL2/WFS1	10
GO:0098781	ncRNA transcription	10/195	135/16259	5.254213188736211e-6	0.0012632943909964658	0.001058132867053709	CDK7/PWP1/EGFR/EGR1/ETS1/FOS/GATA3/JUN/BMP4/NR1H2	10
GO:1904706	negative regulation of vascular associated smooth muscle cell proliferation	5/195	22/16259	5.259031065700422e-6	0.0012632943909964658	0.001058132867053709	CDKN1A/CDKN1B/GPER1/MEF2C/BMP4	5
GO:1904705	regulation of vascular associated smooth muscle cell proliferation	7/195	58/16259	5.744517705458405e-6	0.0012879208695637744	0.0010787599564776624	CDKN1A/CDKN1B/GNAI2/GPER1/JUN/MEF2C/BMP4	7
GO:2000628	regulation of miRNA metabolic process	8/195	83/16259	6.779404117711516e-6	0.0014249460029914893	0.0011935319354602642	EGFR/EGR1/ETS1/FOS/GATA3/JUN/BMP4/NR1H2	8
GO:1990874	vascular associated smooth muscle cell proliferation	7/195	60/16259	7.230931898050583e-6	0.001430448469008477	0.0011981407900423131	CDKN1A/CDKN1B/GNAI2/GPER1/JUN/MEF2C/BMP4	7
GO:2000630	positive regulation of miRNA metabolic process	7/195	61/16259	8.086107436570654e-6	0.0015107544060659506	0.0012654048830563198	EGFR/EGR1/ETS1/FOS/GATA3/JUN/NR1H2	7
GO:0034620	cellular response to unfolded protein	8/195	87/16259	9.64131260109047e-6	0.0017065123303930132	0.0014293713307766257	DAXX/ATF6/ERO1A/HSPD1/BAX/WFS1/NCK2/MBTPS1	8
GO:0071901	negative regulation of protein serine/threonine kinase activity	8/195	89/16259	1.1417308820351916e-5	0.0019198204781421748	0.0016080378106979856	CDKN1A/CDKN1B/CDKN2A/CEBPA/PKIG/RB1/RGS2/TESK1	8
GO:0033002	muscle cell proliferation	11/195	196/16259	2.5010222668492022e-5	0.004005208515911365	0.003354754679743592	CDKN1A/CDKN1B/FOS/GNAI2/GPER1/ID2/JUN/MEF2C/MNAT1/BMP4/TBX2	11
GO:0048660	regulation of smooth muscle cell proliferation	9/195	132/16259	3.0422332767461757e-5	0.004350455813028403	0.0036439331285237206	CDKN1A/CDKN1B/GNAI2/GPER1/ID2/JUN/MEF2C/MNAT1/BMP4	9
GO:0006469	negative regulation of protein kinase activity	10/195	165/16259	3.053191860117258e-5	0.004350455813028403	0.0036439331285237206	CDKN1A/CDKN1B/CDKN2A/CEBPA/PKIG/HSPB1/RB1/RGS2/TESK1/MVP	10
GO:0010586	miRNA metabolic process	8/195	102/16259	3.1046963875314207e-5	0.004350455813028403	0.0036439331285237206	EGFR/EGR1/ETS1/FOS/GATA3/JUN/BMP4/NR1H2	8
GO:0048659	smooth muscle cell proliferation	9/195	136/16259	3.851825838028998e-5	0.005097315425877228	0.004269501253469635	CDKN1A/CDKN1B/GNAI2/GPER1/ID2/JUN/MEF2C/MNAT1/BMP4	9
GO:0072331	signal transduction by p53 class mediator	10/195	170/16259	3.940832621849775e-5	0.005097315425877228	0.004269501253469635	CDKN1A/CDKN1B/RRS1/PPP1R13B/RRP8/PSMD10/BAX/AURKA/USP7/DYRK3	10
GO:0035967	cellular response to topologically incorrect protein	8/195	107/16259	4.3853232326627644e-5	0.0052959625983420916	0.004435887729678525	DAXX/ATF6/ERO1A/HSPD1/BAX/WFS1/NCK2/MBTPS1	8
GO:1904036	negative regulation of epithelial cell apoptotic process	6/195	54/16259	4.409365232042181e-5	0.0052959625983420916	0.004435887729678525	CDKN1B/PAK4/GATA3/SERPINE1/RB1/WFS1	6
GO:0043433	negative regulation of DNA-binding transcription factor activity	9/195	141/16259	5.1137144767802416e-5	0.0059301454432455014	0.00496707801809943	CDKN2A/HDAC2/ID2/NFKBIE/PSMD10/RB1/WFS1/USP7/BHLHE40	9
GO:0033673	negative regulation of kinase activity	10/195	179/16259	6.098991463715929e-5	0.006836969430825557	0.005726631984878536	CDKN1A/CDKN1B/CDKN2A/CEBPA/PKIG/HSPB1/RB1/RGS2/TESK1/MVP	10
GO:0009226	nucleotide-sugar biosynthetic process	4/195	19/16259	6.752862364922003e-5	0.007245737111286929	0.006069014980297611	GNPDA1/GFPT1/GFUS/UGDH	4
GO:1902749	regulation of cell cycle G2/M phase transition	8/195	114/16259	6.894546165958422e-5	0.007245737111286929	0.006069014980297611	CDKN1A/TOPBP1/ORC1/AURKA/DYRK3/MBTPS1/KIF14/CDC25B	8
GO:0043620	regulation of DNA-templated transcription in response to stress	5/195	37/16259	7.52257243019895e-5	0.007666185176593658	0.00642118144281097	EGR1/ATF6/JUN/RPS6KA1/NCK2	5
GO:0045931	positive regulation of mitotic cell cycle	8/195	116/16259	7.79844207651989e-5	0.00771357667745188	0.006460876469587377	UBE2C/EGFR/USP22/RB1/STAT5B/AURKA/DYNLT3/CDC25B	8
GO:0030225	macrophage differentiation	6/195	60/16259	8.052716760433008e-5	0.007737510418667488	0.0064809233235845806	CEBPA/PARP1/GATA3/ID2/RB1/BMP4	6
GO:0044839	cell cycle G2/M phase transition	9/195	153/16259	9.628147731250538e-5	0.008994294672276545	0.007533603312522352	CDKN1A/TOPBP1/ORC1/AURKA/DYRK3/MBTPS1/MELK/KIF14/CDC25B	9
GO:0045736	negative regulation of cyclin-dependent protein serine/threonine kinase activity	4/195	21/16259	1.023315586118578e-4	0.009056342937149416	0.007585574815660152	CDKN1A/CDKN1B/CDKN2A/CEBPA	4
GO:1904030	negative regulation of cyclin-dependent protein kinase activity	4/195	21/16259	1.023315586118578e-4	0.009056342937149416	0.007585574815660152	CDKN1A/CDKN1B/CDKN2A/CEBPA	4
GO:0036500	ATF6-mediated unfolded protein response	3/195	9/16259	1.3530632289073942e-4	0.011667568304655299	0.009772731985306846	ATF6/WFS1/MBTPS1	3
GO:0030218	erythrocyte differentiation	8/195	127/16259	1.4710443467281186e-4	0.012367805345116657	0.01035924913643275	ALAS1/ETS1/GATA3/ID2/RB1/BMP4/STAT5B/DYRK3	8
GO:1905207	regulation of cardiocyte differentiation	4/195	24/16259	1.766396932288788e-4	0.014488763129968767	0.012135759154826177	EGFR/GPER1/MEF2C/BMP4	4
GO:0032922	circadian regulation of gene expression	6/195	70/16259	1.9098612653313372e-4	0.015292531988831634	0.012808994350944005	EGR1/GFPT1/HDAC2/ID2/NRIP1/BHLHE40	6
GO:0002262	myeloid cell homeostasis	9/195	169/16259	2.0468632213464262e-4	0.016008374449739605	0.013408582571170223	ALAS1/ETS1/GATA3/ID2/BAX/RB1/BMP4/STAT5B/DYRK3	9
GO:0010389	regulation of G2/M transition of mitotic cell cycle	7/195	102/16259	2.2638868586688548e-4	0.017303298876598542	0.014493208693296305	CDKN1A/TOPBP1/ORC1/AURKA/MBTPS1/KIF14/CDC25B	7
GO:0034101	erythrocyte homeostasis	8/195	136/16259	2.3569934769325922e-4	0.017597324309571453	0.014739483810636871	ALAS1/ETS1/GATA3/ID2/RB1/BMP4/STAT5B/DYRK3	8
GO:0030968	endoplasmic reticulum unfolded protein response	6/195	73/16259	2.4070083801376358e-4	0.017597324309571453	0.014739483810636871	ATF6/ERO1A/BAX/WFS1/NCK2/MBTPS1	6
GO:0010212	response to ionizing radiation	8/195	137/16259	2.477858045264759e-4	0.01772986511962848	0.014850499729291143	CDKN1A/TOPBP1/PARP1/DNMT3A/EGR1/GATA3/BAX/TP53BP1	8
GO:0000086	G2/M transition of mitotic cell cycle	8/195	138/16259	2.6037533029647526e-4	0.017852801171359317	0.01495347072149163	CDKN1A/TOPBP1/ORC1/AURKA/MBTPS1/MELK/KIF14/CDC25B	8
GO:0048662	negative regulation of smooth muscle cell proliferation	5/195	48/16259	2.6559292766373065e-4	0.017852801171359317	0.01495347072149163	CDKN1A/CDKN1B/GPER1/MEF2C/BMP4	5
GO:2000351	regulation of endothelial cell apoptotic process	5/195	48/16259	2.6559292766373065e-4	0.017852801171359317	0.01495347072149163	PAK4/GATA3/GPER1/SERPINE1/CCL2	5
GO:0010469	regulation of signaling receptor activity	7/195	105/16259	2.7073828716602e-4	0.017852801171359317	0.01495347072149163	ADRB2/HDAC2/MEF2C/SERPINE1/CCL2/NCOA3/CAPN1	7
GO:1905209	positive regulation of cardiocyte differentiation	3/195	12/16259	3.450751365969594e-4	0.02231707085337643	0.018692734120110594	GPER1/MEF2C/BMP4	3
GO:0061333	renal tubule morphogenesis	6/195	79/16259	3.70371336503599e-4	0.02346308476361754	0.01965263308995431	COL4A1/GATA3/MEF2C/BMP4/PAX8/HS2ST1	6
GO:1900101	regulation of endoplasmic reticulum unfolded protein response	4/195	29/16259	3.7674890789037973e-4	0.02346308476361754	0.01965263308995431	ATF6/BAX/WFS1/NCK2	4
GO:0050873	brown fat cell differentiation	5/195	52/16259	3.878058797426338e-4	0.02369866694006604	0.019849956251973246	CEBPA/ADRB2/ERO1A/RGS2/PEX11A	5
GO:0030308	negative regulation of cell growth	9/195	185/16259	3.997403172826249e-4	0.02369866694006604	0.019849956251973246	CDKN1A/CDKN1B/CDKN2A/CGRRF1/DNAJB2/RB1/RGS2/SPP1/TOMM70	9
GO:0032355	response to estradiol	7/195	112/16259	4.0167232101806846e-4	0.02369866694006604	0.019849956251973246	CDKN1B/DNMT3A/EGFR/GPER1/STAT5B/NCOA3/NRIP1	7
GO:0030856	regulation of epithelial cell differentiation	8/195	148/16259	4.1757636989159724e-4	0.024212229861128302	0.020280115532303345	CDKN1B/GATA3/SERPINE1/PRKX/BMP4/STAT5B/PAX8/NCOA3	8
GO:0072577	endothelial cell apoptotic process	5/195	54/16259	4.628527956685413e-4	0.026382609353106854	0.0220980210742019	PAK4/GATA3/GPER1/SERPINE1/CCL2	5
GO:2000273	positive regulation of signaling receptor activity	4/195	31/16259	4.898566641716098e-4	0.02745646602681873	0.02299748128637242	ADRB2/HDAC2/CCL2/NCOA3	4
GO:1902075	cellular response to salt	9/195	191/16259	5.042173666604325e-4	0.027798082034082534	0.023283618174000303	CDKN1B/CEBPA/DAXX/EGR1/FOS/GNAI2/MEF2C/MAPK13/CDK5R1	9
GO:0046686	response to cadmium ion	5/195	56/16259	5.483452111327221e-4	0.02902138563921004	0.02430825483841998	CDKN1B/DAXX/EGFR/FOS/JUN	5
GO:0043618	regulation of transcription from RNA polymerase II promoter in response to stress	4/195	32/16259	5.546242215136163e-4	0.02902138563921004	0.02430825483841998	EGR1/ATF6/JUN/NCK2	4
GO:0072160	nephron tubule epithelial cell differentiation	3/195	14/16259	5.609247893394745e-4	0.02902138563921004	0.02430825483841998	GATA3/MEF2C/PAX8	3
GO:1901722	regulation of cell proliferation involved in kidney development	3/195	14/16259	5.609247893394745e-4	0.02902138563921004	0.02430825483841998	EGR1/GATA3/BMP4	3
GO:0022612	gland morphogenesis	7/195	119/16259	5.789608321457051e-4	0.029500686037969792	0.024709715898276027	EGFR/PDGFA/BAX/RPS6KA1/BMP4/TBX2/CAPN1	7
GO:0007623	circadian rhythm	9/195	196/16259	6.075392275914763e-4	0.030046388564560805	0.02516679524821657	PARP1/EGR1/GFPT1/HDAC2/ID2/SUV39H1/USP7/NRIP1/BHLHE40	9
GO:0032869	cellular response to insulin stimulus	9/195	196/16259	6.075392275914763e-4	0.030046388564560805	0.02516679524821657	RAB31/PARP1/CTSD/EPRS1/WDTC1/GNAI2/RB1/PIP4K2B/PIK3R3	9
GO:0043281	regulation of cysteine-type endopeptidase activity involved in apoptotic process	8/195	159/16259	6.718143987294704e-4	0.03274364960764071	0.027426015728452522	DNAJB6/MALT1/CTSD/GPER1/HSPD1/BAX/RPS6KA1/SOX2	8
GO:0032352	positive regulation of hormone metabolic process	3/195	15/16259	6.9498276597428e-4	0.033252266297175453	0.027852032055101648	EGR1/GATA3/PAX8	3
GO:0071276	cellular response to cadmium ion	4/195	34/16259	7.020252474277303e-4	0.033252266297175453	0.027852032055101648	DAXX/EGFR/FOS/JUN	4
GO:1905898	positive regulation of response to endoplasmic reticulum stress	4/195	35/16259	7.85238382585518e-4	0.03641774429755908	0.03050343012669393	ATF6/BAX/WFS1/NCK2	4
GO:0009266	response to temperature stimulus	8/195	163/16259	7.905130341129388e-4	0.03641774429755908	0.03050343012669393	DNAJB6/CDKN1A/ADRB2/DAXX/ERO1A/HDAC2/HSPB1/HSPD1	8
GO:0010594	regulation of endothelial cell migration	8/195	164/16259	8.226768558715461e-4	0.037387327922919045	0.03131555144114164	ETS1/FUT1/GATA3/HSPB1/MEF2C/PRCP/TBXA2R/GFUS	8
GO:0090399	replicative senescence	3/195	16/16259	8.478367409999859e-4	0.037516775789249376	0.03142397671628756	CDKN1A/CDKN2A/SERPINE1	3
GO:2000696	regulation of epithelial cell differentiation involved in kidney development	3/195	16/16259	8.478367409999859e-4	0.037516775789249376	0.03142397671628756	GATA3/PRKX/PAX8	3
GO:0051385	response to mineralocorticoid	4/195	36/16259	8.75181265928613e-4	0.03822382593919384	0.03201620051435363	CDKN1A/PARP1/FOS/GPER1	4
GO:0009225	nucleotide-sugar metabolic process	4/195	37/16259	9.721455740045686e-4	0.041627086614930704	0.034866764881466915	GNPDA1/GFPT1/GFUS/UGDH	4
GO:0030879	mammary gland development	7/195	130/16259	9.778590076061629e-4	0.041627086614930704	0.034866764881466915	GATA3/ID2/BAX/BMP4/STAT5B/TBX2/CAPN1	7
GO:1905330	regulation of morphogenesis of an epithelium	5/195	64/16259	0.0010131436327992485	0.04194606901244983	0.035133943902629465	GATA3/PDGFA/BMP4/TBX2/PAX8	5
GO:2000310	regulation of NMDA receptor activity	3/195	17/16259	0.001020462076090275	0.04194606901244983	0.035133943902629465	MEF2C/CCL2/CAPN1	3
GO:0050680	negative regulation of epithelial cell proliferation	7/195	131/16259	0.0010227706390189967	0.04194606901244983	0.035133943902629465	CDKN1B/GATA3/MEF2C/RB1/CCL2/BMP4/SOX2	7
GO:0071392	cellular response to estradiol stimulus	4/195	38/16259	0.0010764231499224008	0.04361459100227752	0.03653149459977609	EGFR/GPER1/NCOA3/NRIP1	4
GO:0031570	DNA integrity checkpoint signaling	7/195	133/16259	0.0011174551771048879	0.04473811619766355	0.03747255706682556	CDKN1A/CDKN1B/TOPBP1/ORC1/TP53BP1/CDC45/MBTPS1	7
GO:0071456	cellular response to hypoxia	7/195	134/16259	0.001167308472793554	0.04618421640005555	0.03868380771759195	CDKN1B/DNMT3A/EGR1/FOS/ERO1A/BNIP3L/SUV39H1	7
GO:0071478	cellular response to radiation	8/195	174/16259	0.001205879318478553	0.046386141718553285	0.03885293996239216	CDKN1A/GNB5/PARP1/EGR1/GATA3/MAPK13/BAX/TP53BP1	8
GO:0000076	DNA replication checkpoint signaling	3/195	18/16259	0.0012137913979282453	0.046386141718553285	0.03885293996239216	TOPBP1/ORC1/CDC45	3
GO:0072079	nephron tubule formation	3/195	18/16259	0.0012137913979282453	0.046386141718553285	0.03885293996239216	GATA3/PAX8/HS2ST1	3
GO:0031063	regulation of histone deacetylation	2/195	5/16259	0.0013974379698686275	0.047816207429578	0.04005076015510922	RRP8/SUV39H1	2
GO:0031065	positive regulation of histone deacetylation	2/195	5/16259	0.0013974379698686275	0.047816207429578	0.04005076015510922	RRP8/SUV39H1	2
GO:0072179	nephric duct formation	2/195	5/16259	0.0013974379698686275	0.047816207429578	0.04005076015510922	GATA3/BMP4	2
GO:0072284	metanephric S-shaped body morphogenesis	2/195	5/16259	0.0013974379698686275	0.047816207429578	0.04005076015510922	BMP4/PAX8	2
GO:1901723	negative regulation of cell proliferation involved in kidney development	2/195	5/16259	0.0013974379698686275	0.047816207429578	0.04005076015510922	GATA3/BMP4	2
GO:1903936	cellular response to sodium arsenite	2/195	5/16259	0.0013974379698686275	0.047816207429578	0.04005076015510922	DAXX/MAPK13	2
GO:1904906	positive regulation of endothelial cell-matrix adhesion via fibronectin	2/195	5/16259	0.0013974379698686275	0.047816207429578	0.04005076015510922	FUT1/GFUS	2
GO:1905563	negative regulation of vascular endothelial cell proliferation	2/195	5/16259	0.0013974379698686275	0.047816207429578	0.04005076015510922	MEF2C/CCL2	2
GO:2000611	positive regulation of thyroid hormone generation	2/195	5/16259	0.0013974379698686275	0.047816207429578	0.04005076015510922	GATA3/PAX8	2
GO:0061326	renal tubule development	6/195	102/16259	0.001429865521701532	0.047816207429578	0.04005076015510922	COL4A1/GATA3/MEF2C/BMP4/PAX8/HS2ST1	6
GO:0001709	cell fate determination	4/195	41/16259	0.0014360502379980307	0.047816207429578	0.04005076015510922	GATA3/MEF2C/BMP4/TBX2	4
GO:0060443	mammary gland morphogenesis	4/195	41/16259	0.0014360502379980307	0.047816207429578	0.04005076015510922	BAX/BMP4/TBX2/CAPN1	4
GO:0140467	integrated stress response signaling	4/195	41/16259	0.0014360502379980307	0.047816207429578	0.04005076015510922	CEBPA/FOS/JUN/NCK2	4
